{
  "schema": "tmxy.ue.golden-import-report",
  "schema_version": 1,
  "report_version": "1.0.0",
  "run_id": "p1-20-host-baseline",
  "golden_root": "/Game/TMXY/Golden",
  "golden_map": "/Game/TMXY/Golden/Maps/TMXYGoldenTestMap",
  "interchange_manifest": "Contracts/examples/asset-interchange-v1.example.json",
  "import_mode": "validate-only",
  "before_import": {
    "phase": "before-import",
    "packages": [
      {
        "package_name": "/Game/TMXY/Golden/Maps/TMXYGoldenTestMap",
        "class_name": "World",
        "content_sha256": "fcacd47465359c168203cda8344f070549d46885637ea9479354406f05dce269"
      }
    ],
    "map_count": 1,
    "imported_asset_count": 0
  },
  "after_import": {
    "phase": "after-import",
    "packages": [
      {
        "package_name": "/Game/TMXY/Golden/Maps/TMXYGoldenTestMap",
        "class_name": "World",
        "content_sha256": "fcacd47465359c168203cda8344f070549d46885637ea9479354406f05dce269"
      }
    ],
    "map_count": 1,
    "imported_asset_count": 0
  },
  "outcome": {
    "status": "not-run",
    "imported_asset_count": 0,
    "warnings": [
      "P1-20 establishes the host only; asset import begins at P1-21."
    ],
    "errors": []
  }
}
